{
  "schema_version": "agent-report.v0",
  "task_id": "official-v1-task-001-bounded-edit",
  "task_version": "0.1.0-local",
  "challenge_id": "local-mvp-task-001",
  "agent_profile_snapshot": {
    "agent_label": "FILL_ME_AGENT_NAME",
    "model_label": "FILL_ME_MODEL_NAME",
    "reasoning_depth": "FILL_ME_REASONING_DEPTH",
    "tool_profile": "FILL_ME_TOOL_PROFILE",
    "permission_profile": "FILL_ME_PERMISSION_PROFILE",
    "self_reported": true
  },
  "completion_status": "partial",
  "claimed_files_changed": [
    "src/bounded-fixture.js",
    "tests/bounded-fixture.test.js"
  ],
  "claimed_tests_run": [
    "node tests/bounded-fixture.test.js"
  ],
  "claimed_tests_passed": false,
  "risks": [],
  "deviations": [],
  "blocked_or_uncertain_decisions": [],
  "follow_up_work": [],
  "evidence_refs": [
    "artifacts/test-evidence.json",
    "artifacts/diff-scope-summary.json"
  ],
  "privacy": {
    "summary_only": true,
    "prompt_response_included": false,
    "model_response_included": false,
    "raw_diff_included": false,
    "source_included": false,
    "secrets_included": false,
    "credentials_included": false,
    "customer_payload_included": false
  }
}
